{"acknowledgeFailClosedGap":true,"documentAdditions":[],"documentReplacementBatches":[],"documentRetirements":[{"contexts":["PRIMER_INGRESO_EMPLEADO","REGISTRO"],"documentVersionId":"00000000-0000-0000-0000-000000000210","reason":"Retiro explícito de emergencia","sha256":"3333333333333333333333333333333333333333333333333333333333333333"}],"documentReuses":[],"expectedCurrentManifestSha256":"cccccccccccccccccccccccccccccccccccccccccccccccccccccccccccccccc","expectedCurrentPublicationId":"legal-2026-02","expectedEditorialStateFingerprint":"sha256:dddddddddddddddddddddddddddddddddddddddddddddddddddddddddddddddd","expectedReadinessAfter":"NOT_READY","operationId":"00000000-0000-0000-0000-000000000011","operationType":"RETIRE","requirementAdditions":[],"requirementReplacements":[],"requirementRetirements":[{"audiences":["USER","ADMIN_TITULAR"],"context":"PRIMER_INGRESO_EMPLEADO","reason":"Retiro explícito del requisito","requirementVersionId":"00000000-0000-0000-0000-000000000410","statementSha256":"8888888888888888888888888888888888888888888888888888888888888888"}],"requirementReuses":[],"schemaVersion":1,"targetManifestSha256":"cccccccccccccccccccccccccccccccccccccccccccccccccccccccccccccccc","targetPublicationId":"legal-2026-02"}
