{"acknowledgeFailClosedGap":false,"documentAdditions":[{"contexts":["USO_CONTINUADO"],"documentVersionId":"00000000-0000-0000-0000-000000000201","sha256":"dddddddddddddddddddddddddddddddddddddddddddddddddddddddddddddddd"}],"documentReplacementBatches":[{"contexts":["REGISTRO","PRIMER_INGRESO_EMPLEADO"],"predecessors":[{"documentVersionId":"00000000-0000-0000-0000-000000000111","sha256":"1111111111111111111111111111111111111111111111111111111111111111"},{"documentVersionId":"00000000-0000-0000-0000-000000000110","sha256":"2222222222222222222222222222222222222222222222222222222222222222"}],"replacementBatchId":"00000000-0000-0000-0000-000000001001","successors":[{"documentVersionId":"00000000-0000-0000-0000-000000000210","sha256":"3333333333333333333333333333333333333333333333333333333333333333"}]}],"documentRetirements":[{"contexts":["CIERRE_CUENTA"],"documentVersionId":"00000000-0000-0000-0000-000000000120","reason":"Contenido reemplazado sin sucesor","sha256":"4444444444444444444444444444444444444444444444444444444444444444"}],"documentReuses":[{"contexts":["USO_CONTINUADO","REGISTRO"],"documentVersionId":"00000000-0000-0000-0000-000000000101","sha256":"eeeeeeeeeeeeeeeeeeeeeeeeeeeeeeeeeeeeeeeeeeeeeeeeeeeeeeeeeeeeeeee"}],"expectedCurrentManifestSha256":"aaaaaaaaaaaaaaaaaaaaaaaaaaaaaaaaaaaaaaaaaaaaaaaaaaaaaaaaaaaaaaaa","expectedCurrentPublicationId":"legal-2026-01","expectedEditorialStateFingerprint":"sha256:bbbbbbbbbbbbbbbbbbbbbbbbbbbbbbbbbbbbbbbbbbbbbbbbbbbbbbbbbbbbbbbb","expectedReadinessAfter":"READY","operationId":"00000000-0000-0000-0000-000000000010","operationType":"REPLACE","requirementAdditions":[{"audiences":["USER"],"context":"USO_CONTINUADO","requirementVersionId":"00000000-0000-0000-0000-000000000401","statementSha256":"5555555555555555555555555555555555555555555555555555555555555555"}],"requirementReplacements":[{"audiences":["ADMIN_TITULAR"],"context":"PRIMER_INGRESO_EMPLEADO","predecessor":{"requirementVersionId":"00000000-0000-0000-0000-000000000310","statementSha256":"7777777777777777777777777777777777777777777777777777777777777777"},"successor":{"requirementVersionId":"00000000-0000-0000-0000-000000000410","statementSha256":"8888888888888888888888888888888888888888888888888888888888888888"}}],"requirementRetirements":[{"audiences":["USER"],"context":"CIERRE_CUENTA","reason":"Requisito retirado expresamente","requirementVersionId":"00000000-0000-0000-0000-000000000320","statementSha256":"9999999999999999999999999999999999999999999999999999999999999999"}],"requirementReuses":[{"audiences":["USER","ADMIN_TITULAR"],"context":"REGISTRO","requirementVersionId":"00000000-0000-0000-0000-000000000301","statementSha256":"6666666666666666666666666666666666666666666666666666666666666666"}],"schemaVersion":1,"targetManifestSha256":"cccccccccccccccccccccccccccccccccccccccccccccccccccccccccccccccc","targetPublicationId":"legal-2026-02"}
